sede_code,municipality_code,municipality_name,state_code,state_name,score,school_name,dane_code,address,phone,department,municipality,calendar,sector,area,dean
219780001218,19780,SUAREZ,19,CAUCA,63.56648678509905,INSTITUCION EDUCATIVA ASNAZU,219780001218,CORREGIMIENTO ASNAZU,3217813874,CAUCA,SUÁREZ,A,OFICIAL,RURAL,JOSE NEFER MANCILLA CARABALI
227495000260,27495,NUQUI,27,CHOCO,77.98220622383613,CE PASCUAL SANTANDER,227495000260,CORREG DE JURUBIRA,3136142024,CHOCÓ,NUQUÍ,A,OFICIAL,RURAL,WENCESLADO HURTADO POTES
176109002802,76109,BUENAVENTURA,76,VALLE,65.19399827119143,INSTITUCION EDUCATIVA DIOCESANA JESUS ADOLESCENTE,176109002802,IND CL 6 KR 6 TRIUNFO CARR. SIMON BOLIVAR VIA AEROPUERTO KM 13,3172559056 - 3183606951,VALLE DEL CAUCA,BUENAVENTURA,A,OFICIAL,URBANA,VERGARA MUÑOZ HECTOR FERNEY
227205000954,27580,RIO IRO,27,CHOCO,51.24401211926703,IE JESUS ANTONIO RIVAS,227205000954,RIO IRO,3148153482,CHOCÓ,RÍO IRÓ,A,OFICIAL,"URBANA , RURAL",MARIA LILIANA SANCHEZ IBARGUEN
376109005797,76109,BUENAVENTURA,76,VALLE,79.45848518416477,PATRICIO SYMES,376109005797,CL 6 40 A 56,2403965,VALLE DEL CAUCA,BUENAVENTURA,A,NO OFICIAL,URBANA,FRANCY LIDY BURITICA OSORIO
152473000517,52473,MOSQUERA,52,NARIÑO,37.14244176824393,INSTITUCION EDUCATIVA LICEO DEL PACIFICO,152473000517,IND BARRIO AEROPUERTO MPIO MOSQUERA,3136522040,NARIÑO,MOSQUERA,A,OFICIAL,URBANA,EDISON ANTONIO VASQUEZ MORENO
89038082873O,19075,BALBOA,19,CAUCA,71.20515435614016,,,,,,,,,,
219473006636,19473,MORALES,19,CAUCA,71.04936572488509,I.E.DPTAL INDG MISAK MISAK ALA KUSREINUK MINGA EDUCATIVA INTERCULTURAL KURAK CHAK,219473006636,VEREDA BONANZA,3108349696,CAUCA,MORALES,A,OFICIAL,RURAL,JOSÉ ANTONIO ULLUNE USSA
152250000566,52250,EL CHARCO,52,NARIÑO,63.557302077380655,INSTITUCION EDUCATIVA TECNICA COMERCIAL SAN JUAN BAUTISTA,152250000566,KR 2 12 25,3137801363,NARIÑO,EL CHARCO,A,OFICIAL,URBANA,MODESTO TOLOZA CASTRO
319573000818,19573,PUERTO TEJADA,19,CAUCA,78.19523236407204,INSTITUCION EDUCATIVA CIENCIAS DEL SABER INECS,319573000818,KR 19 18 29,3174077604,CAUCA,PUERTO TEJADA,A,NO OFICIAL,URBANA,EVER ZAPATA GONZALEZ
219473000891,19473,MORALES,19,CAUCA,41.66264175232979,INSTITUCION EDUCATIVA INTERCULTURAL SEK WALAC A (SOL CRECIENTE),219473000891,VEREDA LA BODEGA,3163998683,CAUCA,MORALES,A,OFICIAL,RURAL,LUBER CALAMBAS RIVERA
219142000077,19142,CALOTO,19,CAUCA,50.92787787169598,INSTITUCION EDUCATIVA AGROPECUARIA ETNOEDUCATIVA EL CREDO,219142000077,VDA. EL CREDO,3136469699,CAUCA,CALOTO,A,OFICIAL,RURAL,WILIAM ASCUE FERNANDEZ
6272048O1618,19473,MORALES,19,CAUCA,58.43186793591673,,,,,,,,,,
219256000191,19256,EL TAMBO,19,CAUCA,63.616788694621356,INSTITUCION EDUCATIVA CUATRO ESQUINAS,219256000191,CORREGIMIENTO CUATRO ESQUINAS,3122625535,CAUCA,EL TAMBO,A,OFICIAL,RURAL,JESUS HUMBERTO NARVAEZ MORILLO
176109000311,76109,BUENAVENTURA,76,VALLE,61.89268481543597,LAS AMERICAS,176109000311,KR 65 A CL 6 A 00,,VALLE DEL CAUCA,BUENAVENTURA,A,OFICIAL,URBANA,JUAN DEMETRIO PANAMEÑO VALENCIA
176109000311,76109,BUENAVENTURA,76,VALLE,61.89268481543597,LAS AMERICAS,176109000311,KR 65 A CL 6 A 00,,VALLE DEL CAUCA,BUENAVENTURA,A,OFICIAL,URBANA,JUAN DEMETRIO PANAMEÑO VALENCIA
527610900095,76109,BUENAVENTURA,76,VALLE,55.66430635728639,,,,,,,,,,
276109002009,76109,BUENAVENTURA,76,VALLE,60.20730928934018,RAUL OREJUELA BUENO,276109002009,RIO NAYA,2401972- 3183202029- 3113121558- 3163535169,VALLE DEL CAUCA,BUENAVENTURA,A,OFICIAL,RURAL,ROSA NINFA CUERO SANTANA
219698001595,19698,SANTANDER DE QUILICHAO,19,CAUCA,63.236413390994755,I.E. JOSE MARIA CORDOBA,219698001595,CORREGIMIENTO DE MONDOMO BARRIO BELEN,3168727172,CAUCA,SANTANDER DE QUILICHAO,A,OFICIAL,RURAL,JOSE EYBER VELASCO TRUJILLO
227361001286,27250,EL LITORAL DEL SAN JUAN,27,CHOCO,47.4393143647558,CE MARIA AUXILIADORA DE CUCURRUPI,227361001286,CORREG CUCURRUPI,3105970395,CHOCÓ,EL LITORAL DEL SAN JUAN,A,OFICIAL,RURAL,HUBERT GAMBOA MORENO
119318000023,19318,GUAPI,19,CAUCA,27.245919532170497,INSTITUCION EDUCATIVA NORMAL SUPERIOR LA INMACULADA,119318000023,KR 2 13 110,3122028263,CAUCA,GUAPI,A,OFICIAL,URBANA,RELLY RIASCOS CASTRO
227491000273,27491,NOVITA,27,CHOCO,67.30316497911542,CE SAN ONOFRE,227491000273,JUNTAS DEL TAMANA,3148692220,CHOCÓ,NÓVITA,A,OFICIAL,RURAL,JUAN FRANCISCO RIVAS TORRES
227075000213,27075,BAHIA SOLANO (MUTIS),27,CHOCO,55.186702408616384,IE NORMAL SUPERIOR SANTA TERESITA,227075000213,EL VALLE,6827910-3206588286,CHOCÓ,BAHÍA SOLANO,A,OFICIAL,RURAL,FILIBERTO MENA DOMINGUEZ
376109009326,76109,BUENAVENTURA,76,VALLE,61.29874150657772,LICEO EL LIBERTADOR,376109009326,KR 44 2 35,,VALLE DEL CAUCA,BUENAVENTURA,A,NO OFICIAL,URBANA,JULIO ERNESTO ASTUDILLO ESTUPIÑAN
252835003891,52835,TUMACO,52,NARIÑO,70.07630692560357,IE. MANUEL BENITEZ DUCLERG,252835003891,CORREGIMIENTO PITAL DE LA COSTA,3232258185,NARIÑO,SAN ANDRES DE TUMACO,A,OFICIAL,RURAL,EDUD CETRE GARCIA
152835004958,52835,TUMACO,52,NARIÑO,57.586149919385726,IE .INST. TEC. POPULAR DE LA COSTA,152835004958,AV LA PLAYA 6 40 <EOF>,7277621-3147455267-3208236907,NARIÑO,SAN ANDRES DE TUMACO,A,OFICIAL,URBANA,ORTIZ ORTIZ CARLOS ALFREDO
276109002939,76109,BUENAVENTURA,76,VALLE,68.77602527901027,ATANASIO GIRARDOT,276109001266,ZACARIAS RIO DAGUA,3154066261 - 3173663323,VALLE DEL CAUCA,BUENAVENTURA,A,OFICIAL,RURAL,OLGA MARIA RIASCOS MOSQUERA
219142000239,19300,GUACHENÉ,19,CAUCA,60.47405911373519,INSTITUCION EDUCATIVA ECOLOGICA VEREDAS UNIDAS BARRAGAN,219142000239,VEREDA BARRAGAN,3122060977,CAUCA,GUACHENÉ,A,OFICIAL,RURAL,JORGE ENRIQUE TEJADA VIAFARA
127615001902,27615,RIOSUCIO,27,CHOCO,79.66612051745534,IE NUESTROS ESFUERZOS,127615001902,SIN INFORMACION,3146329840,CHOCÓ,RIOSUCIO,A,OFICIAL,"URBANA , RURAL",PEDRO JOSE PALOMEQUE LEMUS
127615001902,27615,RIOSUCIO,27,CHOCO,79.66612051745534,IE NUESTROS ESFUERZOS,127615001902,SIN INFORMACION,3146329840,CHOCÓ,RIOSUCIO,A,OFICIAL,"URBANA , RURAL",PEDRO JOSE PALOMEQUE LEMUS
319573000567,19573,PUERTO TEJADA,19,CAUCA,61.625761180850496,COLEGIO BAHAI RUHI ARBAB,319573000567,CL 20 20 23,3177665403 - 3174020382,CAUCA,PUERTO TEJADA,A,NO OFICIAL,URBANA,WLDANIA GUTIERREZ DIAZ
376109011738,76109,BUENAVENTURA,76,VALLE,69.00992726530951,I.E. EL MODELO,376109011738,KR 41 A 5 A 04,,VALLE DEL CAUCA,BUENAVENTURA,A,NO OFICIAL,URBANA,BENILDA ESTUPIÑAN SOLIS
376109000086,76109,BUENAVENTURA,76,VALLE,75.848003481039,SEMINARIO SAN BUENAVENTURA,376109000086,IND CALL 6 47C60,2420754,VALLE DEL CAUCA,BUENAVENTURA,A,NO OFICIAL,URBANA,ALBA CELMIRA CASTILLO GOMEZ
319573000249,19573,PUERTO TEJADA,19,CAUCA,58.23211166721245,COLEGIO EVANGELICO EBENEZER,319573000249,KR 15 16 53,3104202394,CAUCA,PUERTO TEJADA,A,NO OFICIAL,URBANA,EDNA MELFI SALDAÑA CHARA
246827O25398,76109,BUENAVENTURA,76,VALLE,48.88777328101756,,,,,,,,,,
127099000210,27099,BOJAYA (BELLAVISTA),27,CHOCO,59.647417553468316,IE CESAR CONTO,127099000210,BELLAVISTA,3122586146,CHOCÓ,BOJAYA,A,OFICIAL,"URBANA , RURAL",ANA NECIS MENA RENTERIA
127099000210,27099,BOJAYA (BELLAVISTA),27,CHOCO,59.647417553468316,IE CESAR CONTO,127099000210,BELLAVISTA,3122586146,CHOCÓ,BOJAYA,A,OFICIAL,"URBANA , RURAL",ANA NECIS MENA RENTERIA
219780000246,19780,SUAREZ,19,CAUCA,59.466385071656866,INSTITUCION EDUCATIVA SANTA MARTA (ANTES CENTRO EDUCATIVO SANTA MARTA),219780000246,VEREDA SANTA MARTA,3137207617,CAUCA,SUÁREZ,A,OFICIAL,RURAL,JOSE DOBER LUCUMI URRUTIA
427361002222,27810,UNION PANAMERICANA,27,CHOCO,73.30168930603531,IE SANTO ECCEHOMO,427361002222,RASPADURA,3127986202,CHOCÓ,UNIÓN PANAMERICANA,A,OFICIAL,RURAL,ZAIDA INES ASPRILLA MOSQUERA
127001018001,27001,QUIBDO,27,CHOCO,79.92973641760108,IE DIOCESANO PEDRO GRAU Y AROLA,127001018001,IND PARQUE LA GLORIA,312 7345861,CHOCÓ,QUIBDÓ,A,OFICIAL,"URBANA , RURAL",JHON FITZGERALD MOSQUERA DUEÑAS
127001018001,27001,QUIBDO,27,CHOCO,79.92973641760108,IE DIOCESANO PEDRO GRAU Y AROLA,127001018001,IND PARQUE LA GLORIA,312 7345861,CHOCÓ,QUIBDÓ,A,OFICIAL,"URBANA , RURAL",JHON FITZGERALD MOSQUERA DUEÑAS
276109000855,76109,BUENAVENTURA,76,VALLE,65.37515918717915,ESTHER ETELVINA ARAMBURO,276109000855,RIO YURUMANGUI,3167560090-2413578,VALLE DEL CAUCA,BUENAVENTURA,A,OFICIAL,RURAL,EDDIL CAICEDO ARROYO
252490001220,52490,OLAYA HERRERA,52,NARIÑO,54.66856724325242,INSTITUCION EDUCATIVA SAN JOSE CALABAZAL,252490001220,VEREDA SAN JOSE CALABAZAL,3116050787,NARIÑO,OLAYA HERRERA,A,OFICIAL,RURAL,COLON SALAS PALOMINO
219698000319,19698,SANTANDER DE QUILICHAO,19,CAUCA,48.77081458845447,I. E. BAJO SAN FRANCISCO,219698000319,VEREDA BAJO SAN FRANCISCO,3205768532-8443856,CAUCA,SANTANDER DE QUILICHAO,A,OFICIAL,RURAL,IVAN HARDIEL ALAPE REALPE
152427000626,52427,MAGUI (PAYAN),52,NARIÑO,49.59228247147777,INSTITUCION EDUCATIVA ELISEO PAYAN,152427000626,IND MAGUI PAYAN (CASCO URBANO),3148859681,NARIÑO,MAGÜI,A,OFICIAL,"URBANA , RURAL",NORA AMERICA ANGULO QUIÑONES
127615000043,27615,RIOSUCIO,27,CHOCO,34.14989488456219,IE SAULO SANCHEZ CORDOBA,127615000043,RIOSUCIO,3137210968,CHOCÓ,RIOSUCIO,A,OFICIAL,"URBANA , RURAL",MARCO TULIO MORENO TERAN
419110001623,19110,BUENOS AIRES,19,CAUCA,55.68456940621553,INSTITUCION EDUCATIVA CERRO CATALINA,419110001623,VEREDA NUEVA GRANADA,3142405225,CAUCA,BUENOS AIRES,A,OFICIAL,RURAL,UBER DANILO DAZA PEÑA
319142001108,19142,CALOTO,19,CAUCA,56.66082186247448,COLEGIO PARA JOVENES Y ADULTOS JUAN PABLO II - COLJAPA,319142001108,CL 9 CON KR 5 ESQ,3137751841 - 3104123241,CAUCA,CALOTO,A,NO OFICIAL,URBANA,CARLOS ARMANDO UL ORTIZ
219110001641,19110,BUENOS AIRES,19,CAUCA,49.327290233047265,INSTITUCION EDUCATIVA AGROINDUSTRIAL VALENTIN CARABALI,219110001641,CORREGIMIENTO LA BALSA,3226551600,CAUCA,BUENOS AIRES,A,OFICIAL,RURAL,MARIA MERY PEÑA GONZALES
152835004109,52835,TUMACO,52,NARIÑO,56.3884926976176,IE. GENERAL SANTANDER,152835004109,IND CALLE NUEVA CREACION,3156614821,NARIÑO,SAN ANDRES DE TUMACO,A,OFICIAL,URBANA,GLADIS CECILIA CASTRO CABEZAS
152835000791,52835,TUMACO,52,NARIÑO,52.878161086319395,IE. IBERIA,152835000791,IND IBERIA,3167727841,NARIÑO,SAN ANDRES DE TUMACO,A,OFICIAL,URBANA,AMANDA DEL CARMEN GONZALEZ MARIN
376109015725,76109,BUENAVENTURA,76,VALLE,53.51898523858144,INSTITUCIÓN EDUCATIVA LA MEDALLA MILAGROSA,376109015725,CL 5 17 28,,VALLE DEL CAUCA,BUENAVENTURA,A,NO OFICIAL,URBANA,GENOVEVA ALBORNOZ MINA
219212000339,19212,CORINTO,19,CAUCA,70.26733551914583,INSTITUCION EDUCATIVA AGROPECUARIA CARRIZALES,219212000339,VEREDA CARRIZALES,3136337150 3165435775,CAUCA,CORINTO,A,OFICIAL,RURAL,JUAN FERNANDO CAMPO RIVERA
152490000059,52490,OLAYA HERRERA,52,NARIÑO,57.245982041918055,INSTITUCION EDUCATIVA LITORAL PACIFICO,152490000059,IND AVENIDA LOS ESTUDIANTES,3167390623,NARIÑO,OLAYA HERRERA,A,OFICIAL,"URBANA , RURAL",LUCY JANETH RODRIGUEZ
352835007859,52835,TUMACO,52,NARIÑO,61.59624474818526,INSTITUCION EDUCATIVA LICEO SAN ANDRES DE TUMACO,352835007859,IND SALIDA CIUDADELA DIAGAONAL SECRETARIA DE TRANSITO DE TUMACO,3167520987 - 3146592069,NARIÑO,SAN ANDRES DE TUMACO,A,OFICIAL,URBANA,LEXINTON NESLER ANTE CABEZAS
352835007182,52835,TUMACO,52,NARIÑO,73.04593347082576,INST. MIXTO RENACER,352835007182,IND AVENIDA FERREA,3186423077 - 3167213016,NARIÑO,SAN ANDRES DE TUMACO,A,NO OFICIAL,URBANA,MARCOS JAVIER ALZAMORA QUIÑONES
219455000299,19455,MIRANDA,19,CAUCA,66.02975410320283,INSTITUCION EDUCATIVA EL CABILDO (ANTES CENTRO EDUCATIVO EL CABILDO),219455000299,VEREDA EL CABILDO,3104305276,CAUCA,MIRANDA,A,OFICIAL,RURAL,MARIA YINELA ZAMBRANO TROMPETA
219455000299,19455,MIRANDA,19,CAUCA,66.02975410320283,INSTITUCION EDUCATIVA EL CABILDO (ANTES CENTRO EDUCATIVO EL CABILDO),219455000299,VEREDA EL CABILDO,3104305276,CAUCA,MIRANDA,A,OFICIAL,RURAL,MARIA YINELA ZAMBRANO TROMPETA
119698000080,19698,SANTANDER DE QUILICHAO,19,CAUCA,61.625525469312755,I.E. TECNICO AMBIENTAL FERNANDEZ GUERRA,119698000080,CR. 5 7-60,3132343548,CAUCA,SANTANDER DE QUILICHAO,A,OFICIAL,"URBANA , RURAL",LUIS ALEXANDER NAVIA
119698000080,19698,SANTANDER DE QUILICHAO,19,CAUCA,61.625525469312755,I.E. TECNICO AMBIENTAL FERNANDEZ GUERRA,119698000080,CR. 5 7-60,3132343548,CAUCA,SANTANDER DE QUILICHAO,A,OFICIAL,"URBANA , RURAL",LUIS ALEXANDER NAVIA
376109007242,76109,BUENAVENTURA,76,VALLE,68.83679722531173,COLEGIO EL MUNDO DE DANI,376109007242,KR 66 26 36,2444498 - 3174016346,VALLE DEL CAUCA,BUENAVENTURA,A,NO OFICIAL,URBANA,ALBA DORIS YEPES
119142000480,19142,CALOTO,19,CAUCA,71.90686306429338,INSTITUCION EDUCATIVA NUCLEO ESCOLAR RURAL CALOTO,119142000480,KR 5 7 80,3227384322,CAUCA,CALOTO,A,OFICIAL,URBANA,CARMEN ALEXANDRA REYES PEÑA
119212000032,19212,CORINTO,19,CAUCA,80.27633895675812,INSTITUCION EDUCATIVA NUCLEO TECNICO AGROPECUARIO,119212000032,KR. 15 NO. 2 - 27,3165783065,CAUCA,CORINTO,A,OFICIAL,"URBANA , RURAL",MAURICIO OSWALDO ALVAREZ ZUÑIGA
227245000523,27245,EL CARMEN,27,CHOCO,69.57625817154305,IE INDÍGENA TOBIAS QUERAGAMA,227245000523,CARMEN DE ATRATO,3127218266,CHOCÓ,EL CARMEN DE ATRATO,A,OFICIAL,RURAL,HUMBERTO TEQUIA SINTUA
219137001171,19137,CALDONO,19,CAUCA,49.85514332928612,I.E. INSTITUTO EDUCATIVO DE FORMACION INTERCULTURAL COMUNITARIO KWESX UMA KIWE - INFIKUK,119137000293,BARRIO OLAZA PRINCIPAL ASOCIACIÓN DE CABILDOS DEN CLADONO,3146806913,CAUCA,CALDONO,A,OFICIAL,"URBANA , RURAL",DIANA BEATRIZ TUMBO GARCIA
376109003522,76109,BUENAVENTURA,76,VALLE,69.31038013439118,CENTRO EDUCATIVO SANTA ELENA,376109003522,KR 59 6 45,2441866,VALLE DEL CAUCA,BUENAVENTURA,A,NO OFICIAL,URBANA,JOSE IGNACIO QUIÑONEZ
152696000012,52696,SANTA BARBARA (ISCUANDE),52,NARIÑO,67.09417759373626,INSTITUCION EDUCATIVA POLITECNICA SANTA BARBARA,152696000012,IND ISCUANDE NARIÑO,3216361061,NARIÑO,SANTA BÁRBARA,A,OFICIAL,"URBANA , RURAL",YOLANDA SANCHEZ MICOLTA
176109003167,76109,BUENAVENTURA,76,VALLE,64.20555231456939,,,,,,,,,,
376109008303,76109,BUENAVENTURA,76,VALLE,66.58397465622495,CENTRO EDUCATIVO EUSEBIO ANGULO,376109008303,CL 3 A 88 62,3163406031,VALLE DEL CAUCA,BUENAVENTURA,A,NO OFICIAL,URBANA,CAROLINA BONILLA MOSQUERA
376109008303,76109,BUENAVENTURA,76,VALLE,66.58397465622495,CENTRO EDUCATIVO EUSEBIO ANGULO,376109008303,CL 3 A 88 62,3163406031,VALLE DEL CAUCA,BUENAVENTURA,A,NO OFICIAL,URBANA,CAROLINA BONILLA MOSQUERA
219142000131,19300,GUACHENÉ,19,CAUCA,52.153736457458244,INSTITUCION EDUCATIVA LA CABAÑA,219142000131,VEREDA LA CABANA,3128067468,CAUCA,GUACHENÉ,A,OFICIAL,RURAL,MARCO JULIO MORENO OREJUELA
276109001266,76109,BUENAVENTURA,76,VALLE,75.64687369136692,ATANASIO GIRARDOT,276109001266,ZACARIAS RIO DAGUA,3154066261 - 3173663323,VALLE DEL CAUCA,BUENAVENTURA,A,OFICIAL,RURAL,OLGA MARIA RIASCOS MOSQUERA
219698000734,19845,VILLA RICA,19,CAUCA,64.33560808577438,I.E.T. SENON FABIO VILLEGAS,219698000734,KR 16 3 13,3176810294 - 8486275,CAUCA,VILLA RICA,A,OFICIAL,URBANA,DANNY LUZ ESCOBAR MACHADO
119473000081,19473,MORALES,19,CAUCA,74.59059538735806,INSTITUCION EDUCATIVA FRANCISCO ANTONIO RADA,119473000081,CL. PRINCIPAL BARRIO MODELO,3127761433,CAUCA,MORALES,A,OFICIAL,"URBANA , RURAL",SILVIO ANTONIO RUIZ MUÑOZ
119473000081,19473,MORALES,19,CAUCA,74.59059538735806,INSTITUCION EDUCATIVA FRANCISCO ANTONIO RADA,119473000081,CL. PRINCIPAL BARRIO MODELO,3127761433,CAUCA,MORALES,A,OFICIAL,"URBANA , RURAL",SILVIO ANTONIO RUIZ MUÑOZ
319698001859,19698,SANTANDER DE QUILICHAO,19,CAUCA,65.68835219099803,LICEO PEDAGOGICO QUILICHAO,319698001859,KR 11 11 55,8293427-3117484900,CAUCA,SANTANDER DE QUILICHAO,A,NO OFICIAL,URBANA,CELSA BEATRIZ ARRECHEA MOLINA
219698002656,19698,SANTANDER DE QUILICHAO,19,CAUCA,75.90099382063188,INSTITUCION EDUCATIVA AGROPECUARIA BENJAMIN DINDICUE,219698002656,VEREDA PARAMILLO UNO,3128796120,CAUCA,SANTANDER DE QUILICHAO,A,OFICIAL,RURAL,FREDY RIVERA TROCHEZ
227001000882,27050,ATRATO (YUTO),27,CHOCO,51.831145510813045,IE ANTONIO ABAD HINESTROZA,227001000513,YUTO,3218513281,CHOCÓ,ATRATO,A,OFICIAL,"URBANA , RURAL",ADELSON MENA MENA
376109008303,76109,BUENAVENTURA,76,VALLE,61.11987156491298,CENTRO EDUCATIVO EUSEBIO ANGULO,376109008303,CL 3 A 88 62,3163406031,VALLE DEL CAUCA,BUENAVENTURA,A,NO OFICIAL,URBANA,CAROLINA BONILLA MOSQUERA
376109008303,76109,BUENAVENTURA,76,VALLE,61.11987156491298,CENTRO EDUCATIVO EUSEBIO ANGULO,376109008303,CL 3 A 88 62,3163406031,VALLE DEL CAUCA,BUENAVENTURA,A,NO OFICIAL,URBANA,CAROLINA BONILLA MOSQUERA
227615001311,27086,BELEN DE BAJIRA,27,CHOCO,53.358968583701184,IE SIMON BOLIVAR,227615001311,VDA PLAYA ROJA,3236230939,CHOCÓ,NUEVO BELÉN DE BAJIRÁ,A,OFICIAL,RURAL,WALTER EMITH PALACIOS MENA
127361000137,27361,ISTMINA,27,CHOCO,46.11040935319518,IE INSTITUTO INTEGRADO SAN PABLO INDUSTRIAL,127361000137,CRA 7 N¿ 7-115,6702085- 3206339739,CHOCÓ,ISTMINA,A,OFICIAL,"URBANA , RURAL",CARLOS JESUS HURTADO MURILLO
252835005100,52835,TUMACO,52,NARIÑO,78.89932560397611,IE ALTO MIRA FRONTERA,252835005100,VEREDA PALO SECO,3165299594,NARIÑO,SAN ANDRES DE TUMACO,A,OFICIAL,RURAL,BANGUERA SEGUNDO PIO
119573000673,19573,PUERTO TEJADA,19,CAUCA,60.15635029160466,I.E. SAN PEDRO CLAVER,119573000673,CL 18 17 10,8280626 - 313 659 7025,CAUCA,PUERTO TEJADA,A,OFICIAL,URBANA,MARIA ELSY MINA ARAGON
252250000307,52250,EL CHARCO,52,NARIÑO,52.17850720940301,INSTITUCION EDUCATIVA EL HORMIGUERO,252250000307,INSP. EL HORMIGUERO MPIO EL CHARCO NAR.,3136511992,NARIÑO,EL CHARCO,A,OFICIAL,RURAL,SANDRO ESTUPIÑAN PORTOCARRERO
219780000343,19780,SUAREZ,19,CAUCA,60.38523414848665,I.E. AGROAMBIENTAL AGUA CLARA,219780000343,VEREDA AGUA CLARA,3183395072,CAUCA,SUÁREZ,A,OFICIAL,RURAL,LUZ ENITH VALENCIA HERNANDEZ
219075000211,19075,BALBOA,19,CAUCA,67.54351434895418,INSTITUCION EDUCATIVA TECNICA EN SISTEMAS LA BERMEJA,219075000211,VDA. BERMEJA BAJA,3146712715,CAUCA,BALBOA,A,OFICIAL,RURAL,LUIS GERARDO OBANDO CAICEDO
376109001180,76109,BUENAVENTURA,76,VALLE,34.938713611730186,MIGUEL DE CERVANTES SAAVEDRA,376109001180,CL 60 C 8 64,2443747,VALLE DEL CAUCA,BUENAVENTURA,A,NO OFICIAL,URBANA,ESPERANZA VIVEROS
227077000849,27077,BAJO BAUDO   (PIZARRO),27,CHOCO,47.58024401943346,IE NUESTRA SEÑORA DEL CARMEN,227077000849,VILLAMARIA,3214738895,CHOCÓ,BAJO BAUDÓ,A,OFICIAL,RURAL,EDIGMO VALENCIA GONZALEZ
127001000268,27001,QUIBDO,27,CHOCO,59.7417170888369,IE ANTONIO MARIA CLARET,127001003127,CRA 3 # 31-99,6723756,CHOCÓ,QUIBDÓ,A,OFICIAL,"URBANA , RURAL",MARGEL DEL CARMEN RENGIFO VALENCIA
119780000969,19780,SUAREZ,19,CAUCA,63.30308398415015,I.E.T.A. DE SUAREZ,119780000969,IND BARRIO JUAN BLANCO,3126828304,CAUCA,SUÁREZ,A,OFICIAL,URBANA,MARIA EUFEMIA MINA CHARA
119821000031,19821,TORIBIO,19,CAUCA,41.94153774045639,I.E. TORIBIO,119821000031,IND CALLE 6 CARRERA 3 Y 4,3113980785 - 3186166674,CAUCA,TORIBIO,A,OFICIAL,"URBANA , RURAL",ROSBITA GOMEZ RENGIFO
219142000352,19142,CALOTO,19,CAUCA,71.3614509370233,INSTITUCION EDUCATIVA TECNICA LA PALOMERA,219142000352,VDA. LA PALOMERA,3226748118,CAUCA,CALOTO,A,OFICIAL,RURAL,CARMEN ROSA GUASAQUILLO TOMBE
219137000204,19137,CALDONO,19,CAUCA,42.963574973523194,I.E. INSTITUTO EDUCATIVO DE FORMACION INTERCULTURAL COMUNITARIO KWESX UMA KIWE - INFIKUK,119137000293,BARRIO OLAZA PRINCIPAL ASOCIACIÓN DE CABILDOS DEN CLADONO,3146806913,CAUCA,CALDONO,A,OFICIAL,"URBANA , RURAL",DIANA BEATRIZ TUMBO GARCIA
227615001222,27086,BELEN DE BAJIRA,27,CHOCO,55.74486825109405,IE LA UNION DE BAJIRA,127615060621,BELENCITO,3146313195 - 3154332103,CHOCÓ,NUEVO BELÉN DE BAJIRÁ,A,OFICIAL,RURAL,ELACIO MOSQUERA QUINTO
252835001538,52835,TUMACO,52,NARIÑO,37.64723779005841,I.E. LA ENSENADA,252835001210,CORREGIMIENTO BOCAS DE CURAY,3164674038,NARIÑO,SAN ANDRES DE TUMACO,A,OFICIAL,RURAL,CLAUDIA ELIANIA RUIZ BENAVIDES
127001003534,27001,QUIBDO,27,CHOCO,54.66090935971855,IE JOSE DEL CARMEN CUESTA RENTERIA,127001003534,CL 24 6 24,3103743675,CHOCÓ,QUIBDÓ,A,OFICIAL,URBANA,DALSON MARTIN ABADIA TORRES
127001003534,27001,QUIBDO,27,CHOCO,54.66090935971855,IE JOSE DEL CARMEN CUESTA RENTERIA,127001003534,CL 24 6 24,3103743675,CHOCÓ,QUIBDÓ,A,OFICIAL,URBANA,DALSON MARTIN ABADIA TORRES
227001001234,27001,QUIBDO,27,CHOCO,63.712905631270544,IE AGROPECUARIA DE TAGACHI,227001003547,AFLUENTE RIO TAGACHI,3136518977,CHOCÓ,QUIBDÓ,A,OFICIAL,RURAL,ELIZABETH MORENO PALACIOS.
176109000290,76109,BUENAVENTURA,76,VALLE,45.93462975396295,PABLO EMILIO CARVAJAL,176109002977,TRASNV. 87 NO 3S-40 BARRIO ALEJANDRO CABAL POMBO,2507614-3234587803,VALLE DEL CAUCA,BUENAVENTURA,A,OFICIAL,"URBANA , RURAL",MARLON ALEXIS POSSO VARELA
376109015547,76109,BUENAVENTURA,76,VALLE,71.46913147064849,LICEO MAYOR LATINO,376109015547,KR 40 A 4 A 42,,VALLE DEL CAUCA,BUENAVENTURA,A,NO OFICIAL,URBANA,MARIA FERNANDA CARMONA MONTOYA
227077000369,27430,MEDIO BAUDO,27,CHOCO,58.7005011281325,IE NUESTRA SEÑORA DEL CARMEN- PUERTO MELUK,227077000369,PUERTO MELUK,3135287189,CHOCÓ,MEDIO BAUDÓ,A,OFICIAL,"URBANA , RURAL",EMIRO ENRIQUE MENA MATURANA
119212000059,19212,CORINTO,19,CAUCA,56.11449910144194,INSTITUCION EDUCATIVA JOSE MARIA OBANDO,119212000059,CARRERA 10 # 8 - 76,3113737277,CAUCA,CORINTO,A,OFICIAL,"URBANA , RURAL",HADWIN LEONEL RIVERA SANTACRUZ
119212000059,19212,CORINTO,19,CAUCA,56.11449910144194,INSTITUCION EDUCATIVA JOSE MARIA OBANDO,119212000059,CARRERA 10 # 8 - 76,3113737277,CAUCA,CORINTO,A,OFICIAL,"URBANA , RURAL",HADWIN LEONEL RIVERA SANTACRUZ
276109005806,76109,BUENAVENTURA,76,VALLE,59.78389318943446,INSTITUCIÓN AGROPECUARIA JOSÉ MARÍA CÓRDOBA,276109005806,IND CORDOBA,3155937697 - 3207434956,VALLE DEL CAUCA,BUENAVENTURA,A,OFICIAL,RURAL,CLARA INES MELENDEZ ANGULO
252835005436,52835,TUMACO,52,NARIÑO,71.65652240600724,IE. INTEGRADA DE CHILVI,252835005436,CORREGIMIENTO ALTO AGUA CLARA,3185402582,NARIÑO,SAN ANDRES DE TUMACO,A,OFICIAL,RURAL,ESTUPIÑAN ORTIZ HERNAN
252835005436,52835,TUMACO,52,NARIÑO,71.65652240600724,IE. INTEGRADA DE CHILVI,252835005436,CORREGIMIENTO ALTO AGUA CLARA,3185402582,NARIÑO,SAN ANDRES DE TUMACO,A,OFICIAL,RURAL,ESTUPIÑAN ORTIZ HERNAN
119137000315,19137,CALDONO,19,CAUCA,56.53588650208714,INSTITUCION EDUCATIVA SUSANA TROCHEZ DE VIVAS,119137000315,CLL 1 # 5-15,3186833773,CAUCA,CALDONO,A,OFICIAL,"URBANA , RURAL",JORGE GIOBANY LUCUMI GONZALEZ
119455000111,19455,MIRANDA,19,CAUCA,54.06765377793911,INSTITUCION EDUCATIVA LEOPOLDO PIZARRO GONZALEZ,119455000111,CR 7 # 12A - 121,3165277236-8476004,CAUCA,MIRANDA,A,OFICIAL,"URBANA , RURAL",RUBIELA JIMENEZ LEON
352835001605,52835,TUMACO,52,NARIÑO,51.10279704872184,IE. SANTA TERESITA,352835001605,IND CALLE CALDAS,7271278-3174012101,NARIÑO,SAN ANDRES DE TUMACO,A,OFICIAL,URBANA,CORTES QUIÑONES HUMBERTO ANTONIO
219110000636,19110,BUENOS AIRES,19,CAUCA,51.37246486732978,INSTITUCION EDUCATIVA PARA EL DESARROLLO INTERCULTURAL DE LAS COMUNIDADES INEDIC,219110000636,CABILDO INDIGENA LAS DELICIAS,3162819954,CAUCA,BUENOS AIRES,A,OFICIAL,RURAL,MIGUEL ANGEL MINA MURILLO
127099000210,27099,BOJAYA (BELLAVISTA),27,CHOCO,54.16097609254136,IE CESAR CONTO,127099000210,BELLAVISTA,3122586146,CHOCÓ,BOJAYA,A,OFICIAL,"URBANA , RURAL",ANA NECIS MENA RENTERIA
127099000210,27099,BOJAYA (BELLAVISTA),27,CHOCO,54.16097609254136,IE CESAR CONTO,127099000210,BELLAVISTA,3122586146,CHOCÓ,BOJAYA,A,OFICIAL,"URBANA , RURAL",ANA NECIS MENA RENTERIA
376109012777,76109,BUENAVENTURA,76,VALLE,36.71735912828471,INSTITUCION EDUCATIVA LOS ALAMOS,376109012777,KR 67 CL 10 06,,VALLE DEL CAUCA,BUENAVENTURA,A,NO OFICIAL,URBANA,LUZ ENITH LONDOÑO GAVIRIA
119473000081,19473,MORALES,19,CAUCA,57.907876611612465,INSTITUCION EDUCATIVA FRANCISCO ANTONIO RADA,119473000081,CL. PRINCIPAL BARRIO MODELO,3127761433,CAUCA,MORALES,A,OFICIAL,"URBANA , RURAL",SILVIO ANTONIO RUIZ MUÑOZ
119473000081,19473,MORALES,19,CAUCA,57.907876611612465,INSTITUCION EDUCATIVA FRANCISCO ANTONIO RADA,119473000081,CL. PRINCIPAL BARRIO MODELO,3127761433,CAUCA,MORALES,A,OFICIAL,"URBANA , RURAL",SILVIO ANTONIO RUIZ MUÑOZ
176109005666,76109,BUENAVENTURA,76,VALLE,72.52979936402981,ANTONIO NARIÑO,176109005666,CL 6 SUR 56 60,3143871359,VALLE DEL CAUCA,BUENAVENTURA,A,OFICIAL,URBANA,ADELINA ARAMBURO GARCIA
219364000440,19364,JAMBALO,19,CAUCA,56.83439993981527,INSTITUCION EDUCATIVA DE FORMACION INTEGRAL MARDEN ARNULFO BETANCUR ZONA BAJA,219364000440,CORREGIMIENTO LOMA REDONDA,3136494669,CAUCA,JAMBALÓ,A,OFICIAL,RURAL,JESUS EDUARD MOSQUERA RAMIREZ
127001004107,27001,QUIBDO,27,CHOCO,75.09687389290123,IE MIA ROGERIO VELASQUEZ MURILLO,127001004107,CL 30 1 10,314632672,CHOCÓ,QUIBDÓ,A,OFICIAL,URBANA,NIDIA ASPRILLA MOSQUERA
227361000166,27361,ISTMINA,27,CHOCO,80.67992175791505,IE MIGUEL ANGEL GUERRERO,227361000166,PAITO,3114142367,CHOCÓ,ISTMINA,A,OFICIAL,RURAL,MARIA DAICY ARBOLEDA CORDOBA
40717492O131,27600,RIO QUITO,27,CHOCO,61.04021154284952,,,,,,,,,,
252079002045,52079,BARBACOAS,52,NARIÑO,71.39381499898514,INSTITUCION EDUCATIVA INDIGENA TECNICA AGROAMBIENTAL BILINGÜE AWA,252079002045,DIVISO,3155120512,NARIÑO,BARBACOAS,A,OFICIAL,RURAL,BISBISCUS JOSE MIGUEL
319698002944,19698,SANTANDER DE QUILICHAO,19,CAUCA,73.93421762123876,COLEGIO DE ADULTOS POR CICLOS INTEGRADOS GIMNASIO DEL NORTE,319698002944,CL 2 A 5 36,3217333771,CAUCA,SANTANDER DE QUILICHAO,A,NO OFICIAL,URBANA,SANDRA MARIA CHICANGANA ANTE
227099000681,27099,BOJAYA (BELLAVISTA),27,CHOCO,43.6022381694709,IE ROBINSON PALACIOS DE NAPIPI,227099000681,NAPIPI,3136721443,CHOCÓ,BOJAYA,A,OFICIAL,RURAL,JUAN ADRIANO PALACIOS COSSIO
227077001349,27077,BAJO BAUDO   (PIZARRO),27,CHOCO,69.10754119569377,IE INDÍGENA DE BUENA VISTA,227077001349,BAJO BAUDO,3217958513,CHOCÓ,BAJO BAUDÓ,A,OFICIAL,RURAL,PABLO ISMARE MEMBACHE
176109000648,76109,BUENAVENTURA,76,VALLE,78.16878877856308,TERMARIT,176109000648,CL 4 KR 53 72,2404012- 3168725415,VALLE DEL CAUCA,BUENAVENTURA,A,OFICIAL,URBANA,HERMELIA TOBAR
176109000623,76109,BUENAVENTURA,76,VALLE,71.33740970201643,,,,,,,,,,
376109008834,76109,BUENAVENTURA,76,VALLE,57.75908311122419,CORPORACION CER,376109008834,KR 68 5 12,2427351,VALLE DEL CAUCA,BUENAVENTURA,A,NO OFICIAL,URBANA,DAYCI ALICIA ROCHA VALENCIA
376109008834,76109,BUENAVENTURA,76,VALLE,57.75908311122419,CORPORACION CER,376109008834,KR 68 5 12,2427351,VALLE DEL CAUCA,BUENAVENTURA,A,NO OFICIAL,URBANA,DAYCI ALICIA ROCHA VALENCIA
327001001000,27001,QUIBDO,27,CHOCO,64.96871849099406,IE SANTO DOMINGO SAVIO,327001001000,CL 25 A 16 110,6708016,CHOCÓ,QUIBDÓ,A,OFICIAL,URBANA,ELCY GLORIA PALACIOS ROMERO
